{
  "$id": "https://eshu.dev/schemas/factschema/packageregistry/v1/vulnerability_hint.schema.json",
  "$schema": "https://json-schema.org/draft/2020-12/schema",
  "additionalProperties": true,
  "properties": {
    "advisory_id": {
      "type": "string"
    },
    "advisory_source": {
      "type": "string"
    },
    "affected_range": {
      "type": [
        "string",
        "null"
      ]
    },
    "collector_instance_id": {
      "type": [
        "string",
        "null"
      ]
    },
    "correlation_anchors": {
      "items": {
        "type": "string"
      },
      "type": [
        "array",
        "null"
      ]
    },
    "ecosystem": {
      "type": [
        "string",
        "null"
      ]
    },
    "fixed_version": {
      "type": [
        "string",
        "null"
      ]
    },
    "modified_at": {
      "type": [
        "string",
        "null"
      ]
    },
    "package_id": {
      "type": "string"
    },
    "published_at": {
      "type": [
        "string",
        "null"
      ]
    },
    "registry": {
      "type": [
        "string",
        "null"
      ]
    },
    "source_severity": {
      "type": [
        "string",
        "null"
      ]
    },
    "summary": {
      "type": [
        "string",
        "null"
      ]
    },
    "url": {
      "type": [
        "string",
        "null"
      ]
    },
    "version": {
      "type": [
        "string",
        "null"
      ]
    },
    "version_id": {
      "type": [
        "string",
        "null"
      ]
    },
    "vulnerability_id": {
      "type": [
        "string",
        "null"
      ]
    }
  },
  "required": [
    "package_id",
    "advisory_id",
    "advisory_source"
  ],
  "title": "Eshu package_registry.vulnerability_hint Payload (schema version 1)",
  "type": "object"
}
