{
  "collector_instance_id": "package-registry-collector-1",
  "ecosystem": "npm",
  "registry": "https://registry.npmjs.org",
  "package_id": "package://npm/registry.npmjs.org/@scope/pkg",
  "version_id": "package://npm/registry.npmjs.org/@scope/pkg@1.2.3",
  "version": "1.2.3",
  "advisory_id": "GHSA-xxxx-yyyy-zzzz",
  "advisory_source": "github",
  "vulnerability_id": "CVE-2026-12345",
  "source_severity": "high",
  "affected_range": "<1.2.4",
  "fixed_version": "1.2.4",
  "url": "https://github.com/advisories/GHSA-xxxx-yyyy-zzzz",
  "summary": "example advisory summary",
  "published_at": "2026-05-01T00:00:00Z",
  "modified_at": "2026-05-02T00:00:00Z",
  "correlation_anchors": ["package://npm/registry.npmjs.org/@scope/pkg"]
}
